{
  "finding_id": "DEMO-FIND-001",
  "application_id": "DEMO-EOA-2026-001",
  "finding_type": "MISSING_EVIDENCE",
  "status": "OPEN",
  "severity": "MEDIUM",
  "title": "Demonstration evidence item is missing",
  "explanation": "The synthetic application bundle has no document mapped to this demo checklist item. This is insufficient evidence, not proof of non-compliance.",
  "observed_values": [],
  "expected_condition": "A document of the configured demo type is attached to this application snapshot.",
  "evidence_refs": [],
  "rule_ref": "DEMO.DOC.FACULTY_CERT_PRESENT",
  "rule_version": "1.0.0",
  "source_refs": [],
  "missing_evidence_reason": "No document was mapped to the demo evidence type.",
  "confidence": null,
  "limitations": ["This is a synthetic demonstration finding.", "The demo rule is not an official AICTE requirement."],
  "recommended_next_action": "Attach the relevant supporting document or ask the reviewer which evidence is acceptable.",
  "created_at": "2026-10-26T12:00:00Z",
  "advisory_only": true,
  "demo_only": true
}
